{
  "artifact": {
    "byte_length": 329,
    "path": "m3_deliverable.md",
    "sha256": "1121ef42a8339a21f0b443ce1689beb5f7eacc960b4a2186b97a9c6afbb13fb9"
  },
  "claims": [
    {
      "admission_use": "working_position",
      "argument_leg": "composition",
      "claim_id": "C-001",
      "load_bearing": true,
      "locator": {
        "byte_end": 328,
        "byte_start": 289,
        "line": 14,
        "section": "References"
      },
      "modal_force": "qualified",
      "provenance": "author_derivation",
      "span_sha256": "0f14949e2d4c1e969dda8f30678063dff80f67c772b94a6675b29c4574a368e6",
      "text": "Synthetic lifecycle target terminal-m3.",
      "viewpoint": "project_position",
      "warrant_relation": "candidate"
    }
  ],
  "coverage_disposition": "complete",
  "created_at": "2026-07-26T00:00:03Z",
  "evaluator_additions": [],
  "evaluator_omissions": [],
  "generator_inventory": [
    "C-001"
  ],
  "register_id": "SCR-TERMINAL_M3",
  "review_dispatch": {
    "dispatch_id": "dispatch-0efeb9d87bb24263",
    "role": "evaluator"
  },
  "schema_version": "1.0.0"
}
