{
  "artifact": {
    "byte_length": 329,
    "path": "m2_deliverable.md",
    "sha256": "a4f408e50e83fab0ca89ddda2cff8e7779a38333dd34c1e9b7342bc5d4e4051e"
  },
  "claims": [
    {
      "admission_use": "working_position",
      "argument_leg": "composition",
      "claim_id": "C-001",
      "load_bearing": true,
      "locator": {
        "byte_end": 328,
        "byte_start": 289,
        "line": 14,
        "section": "References"
      },
      "modal_force": "qualified",
      "provenance": "author_derivation",
      "span_sha256": "b75fdc025766efa20e9ec0d3c1e9627516aab63d8dbff8ef7080829fa6bde794",
      "text": "Synthetic lifecycle target terminal-m2.",
      "viewpoint": "project_position",
      "warrant_relation": "candidate"
    }
  ],
  "coverage_disposition": "complete",
  "created_at": "2026-07-26T00:00:03Z",
  "evaluator_additions": [],
  "evaluator_omissions": [],
  "generator_inventory": [
    "C-001"
  ],
  "register_id": "SCR-TERMINAL_M2",
  "review_dispatch": {
    "dispatch_id": "dispatch-9219256851a25f90",
    "role": "evaluator"
  },
  "schema_version": "1.0.0"
}
