{
  "artifact": {
    "byte_length": 329,
    "path": "m4_deliverable.md",
    "sha256": "d406bdac4738ce8a1836fe58925e43b90378596e8fc38263e82402b2b5d07ec5"
  },
  "claims": [
    {
      "admission_use": "working_position",
      "argument_leg": "composition",
      "claim_id": "C-001",
      "load_bearing": true,
      "locator": {
        "byte_end": 328,
        "byte_start": 289,
        "line": 14,
        "section": "References"
      },
      "modal_force": "qualified",
      "provenance": "author_derivation",
      "span_sha256": "b07d9266dda2609f571220d62250fbc3751f864561b409212159e4738fd2f4b1",
      "text": "Synthetic lifecycle target terminal-m4.",
      "viewpoint": "project_position",
      "warrant_relation": "candidate"
    }
  ],
  "coverage_disposition": "complete",
  "created_at": "2026-07-26T00:00:03Z",
  "evaluator_additions": [],
  "evaluator_omissions": [],
  "generator_inventory": [
    "C-001"
  ],
  "register_id": "SCR-TERMINAL_M4",
  "review_dispatch": {
    "dispatch_id": "dispatch-f65a1534b5b88b9d",
    "role": "evaluator"
  },
  "schema_version": "1.0.0"
}
