{
  "artifact": {
    "byte_length": 387,
    "path": "M1_project_memo.md",
    "sha256": "4f4b76267242ef8b7dd15c5010c1a056010f97abf8e969fd64586d05b358e0a7"
  },
  "claims": [
    {
      "admission_use": "working_position",
      "argument_leg": "composition",
      "claim_id": "C-001",
      "load_bearing": true,
      "locator": {
        "byte_end": 386,
        "byte_start": 339,
        "line": 18,
        "section": "Synthetic analysis"
      },
      "modal_force": "qualified",
      "provenance": "author_derivation",
      "span_sha256": "c882a6195cc45be8798ae9377c2531bf40d144bc60e7888fa10ca0b737b25837",
      "text": "A bounded synthetic M1 claim remains qualified.",
      "viewpoint": "project_position",
      "warrant_relation": "candidate"
    }
  ],
  "coverage_disposition": "complete",
  "created_at": "2026-07-26T00:00:03Z",
  "evaluator_additions": [],
  "evaluator_omissions": [],
  "generator_inventory": [
    "C-001"
  ],
  "register_id": "SCR-M1_INITIAL",
  "review_dispatch": {
    "dispatch_id": "dispatch-680b2ea233e11b3c",
    "role": "evaluator"
  },
  "schema_version": "1.0.0"
}
